[
  {
    "category": "UI Refactor",
    "description": "Integrate glass effects into Button component core styling, matching Card approach",
    "steps": [
      "Verify current Button component variants analyzed (default, destructive, outline, secondary, ghost, link)",
      "Verify current glassButtonVariants usage patterns identified across codebase (card, carousel, action variants)",
      "Verify backdrop-blur-md added to buttonVariants base classes for core glass effect",
      "Verify 'default' variant updated with glass styling: glass-strong text-white hover:bg-white/30",
      "Verify 'ghost' variant updated with glass styling: glass hover:bg-white/20 text-white",
      "Verify 'outline' variant updated to include glass background while maintaining border",
      "Verify 'secondary' variant updated with appropriate glass effect",
      "Verify 'destructive' variant updated with glass effect while maintaining red/destructive colors",
      "Verify 'link' variant remains non-glass (text-only, no background)",
      "Verify glassButtonVariants completely removed from src/lib/utils.ts",
      "Verify GlassButtonVariants type export removed from utils.ts",
      "Verify all components using glassButtonVariants updated to use standard Button variants",
      "Verify ExportCard buttons refactored to use Button with appropriate variant prop",
      "Verify AddonDetailPage buttons refactored to use Button with appropriate variant prop",
      "Verify CopyButton component updated to work with new Button styling",
      "Verify CommandBar buttons updated if using glassButtonVariants",
      "Verify carousel navigation buttons (if any) updated to use new Button variants",
      "Verify all button styling remains visually identical or improved after refactor",
      "Verify glass effects (backdrop-blur, semi-transparent backgrounds) visible on all button variants",
      "Verify hover states maintain proper glass effect intensification",
      "Verify focus states clearly visible with glass styling",
      "Verify button text contrast meets WCAG accessibility standards on glass backgrounds",
      "Verify icon-only buttons maintain proper glass effect",
      "Verify responsive behavior maintained on mobile/tablet/desktop",
      "Verify TypeScript compilation succeeds after refactoring",
      "Verify no console errors or warnings after changes",
      "Verify build process completes successfully"
    ],
    "passes": false
  }
]
